,commentor,comment
605,Md Faiyazul Hussain,Great initiative would build next project
606,vibhu Mishra,Sir please upload new videos in js marathon...
607,Ratul Paul,Very nice Idea. What kind of developers mostly it will projecting the projects... is it just web developers or even cloud/devops guys
608,Pradeep,"Great News, thank you"
609,Tushar Singh,"Everything is what I could have asked for but the idea of public voting could be misused by anyone. Spam, friends, link sharing and asking for vote will become a huge problem soon. Please remove public voting feature and instead only let group of experts to vote on the projects. The expert could be invitational only such that findcoder should invite experts for the domain to vote and show their consensus much like how awwwards chooses the best designed website.
 
Public voting could be replaced with likes and also let the user to sort the list based on likes while only expert votes should decide the best projects."
610,NABIN MAITI,Thank you Sir
611,CODING,Bro there is problem while setting up profile. It is not taking me to 2nd step after taking my details.
612,Surya Padala,Make it like Darwinbox. All the Best.
613,dhanush holla,
614,Gourav Kolhatkar,Hi hitesh make sure the companies and jobs they provide are of quality than the quantity.
615,Md Ehsan,
616,Ͳհąҟմɾ φɾąѵҽҽղ ʂօӀąղҟì,Great..
617,Bishal Nandi,️️️️️️
618,Uttej,Fire 
619,Piyush Mani chaubey,Amazing
620,Mr. Invisible,️
621,Bibek Kakati,
622,Rishabh rathour,Thanxx hitesh
623,Akash Singh,why still only github and linkedIn signin options why not email & pwd?
624,RAM informatique,Good
625,Sankha Subhra Mondal,1st view sir
626,Siva ram,First ️
627,Srajan Jain,First Like and comment
628,Manoj Dewangan,#FirstComment
629,Code light Sparkles,Would love to see a course with functional programming using Scala
630,suman pokhrel,Checked it 1 week ago and yes its just damn fast 
631,Akshay,Great content 
632,Abhishek Guha,"Hey Hitesh! Kudos to all your contributions to tech education. I know how much you revere quality, so just a suggestion from this noob. Change the transition to the layer in the beginning where-in your name appears to be smooth rather than sudden. Keep up the excellent work. "
633,YouAndImpact,Great video 
634,Tami Bar,Does anyone know if bun can be used to load webpages and run them ? Potentially creating a faster browser than chrome or other browsers ? Thx 
635,Rahul Ahire,I'd love to see (or even purchase) a Rust course from you.
636,Bindiya Patel,"Hello sir, sir agar koi student engineering background  se nahi hain to kya wo apka course enroll krke koi skill sikh sakta hain? Sir please guide us"
637,Scripty Vijay,Sir it's giving a manifest error and also we shared this on github but users said simply remove manifest line from HTML but I don't think so this is the solution. So what you say about this?
638,Vasley,"If I were a Bun developer I'd rather called it 'Done' (or Oden, or Enod) just for lulz ))
Then we would have Node, Deno and Done :D"
639,Sivaprasad EV,Thanks man 
640,secureITmania,Waiting for bun course
641,hardik ganatra,"When we say who uses lodash these days ,  I still find it useful , whats an alternative for it  , or did I miss a new boy in the town :) ? Or by that do you mean map , filter , reduce is enough for a full fledged project ?"
642,Richard Levi,"My qts is for them who has already enrolled for the Full stack JavaScript Developer program of ineuron.. 
How's the course? Is it worth purchasing?  How's the live lectures going? 
Basically tell me everything whatever going in the course, it would mean a lot to me."
643,Apoorv Verma,Was waiting for your views on bun...
644,Ben Ochang',Does bun work for react native lol?
645,dogen,Will replace node js?? What should we learn node or bun??
646,Indratej Reddy,Can JS on bun can beat java ?
647,Ankit Maan,First like and comment about bun... What will be the future of bun
648,Patel Ronak,️
649,Abhishek,What happened to JavaScript marathon
650,firos Iam,Hey have u forgoton about  the javascript marathon
651,Kartik Dhawan,Who uses lodash ??? what do people use these days ? ? 
652,sagar roy,Back to grey Tshirt
653,SAUMIL SHAH,"Go to Sandeep Maheshwari show,,,,,,, plz"
654,R Truth,"It will be better if you make videos in hindi, so more people can understand and your subscriber and views will also increase. Like @ApnaCollege"
655,Manivasagam Shanmugam,Just enrolled in the course very excited to learn from you sir 
656,Bishwajeet Das,"Hi Hitesh sir,
I have a couple of questions regarding this course?
1) Course duration?
2) Is it for fresher or experienced professionals?"
657,Mohammad Ayaan Siddiqui,"Hey Hitesh a little request, I was UNABLE to enroll in the javascript bootcamp this year, bcoz of lack of funds.. I hope u will bring it again next year AND IF U DO, kindly also include WEB3 in it.. After js, u can go into solidity and web3 very easily. This will open more doors for the students enrolled.. they can go into web or web3 depending on their choice.. I HOPE u do, and I will SURELY enroll next year."
658,Vibhavari Bellutagi,"Hi Hitesh

Thanks for this course, I was looking for the same content. What is the duration of the course?"
659,Nisarg Rai,"wish this course existed in 2020, no one was solving DSA in JavaScript back then. As a web developer and JavaScript lover, this course is it! If you wanna crack coding interviews."
660,saurabh suryavanshi,Can someone who is enrolled in the full stack bootcamp manage both courses simultaneously? I'd love to join in on this one too!
661,Md Samir,Most awaited course 
662,Bishal Nandi,Enjoying Javascript Bootcamp  Completed 3 Assignments and 2 Articles so far sir 
663,Manish Gupta,"Hi, 
The course doesn't seem to focus more on System Design. Just two modules."
664,Indratej Reddy,One of the beauty of python I'd you focus more on logic rather then syntax
665,Ujjawal Chatterjee,Is this course applicable to absolute beginners in Data Structure? I want to learn DSA using JS.
666,Red Crow Crow,Another new course 
667,CHE tan,Guys trust me who ever has not done data structures and algorithms do it it's one of the most important subject of cs
668,Shubham Goel,Do we get problems to practice like from leetcode or on in-house ineuron coding platform?
669,pandit on rocks,sir can we enroll in future for recorded lectures?
670,Dhiraj Mehta,Is this course for experienced engineers as well?
671,Rajat,"This 4k price is such a sweet spot ️
Couldn't enroll in full stack javascript bootcamp but will definitely enroll in this"
672,ujjwal jain,do you also provide placement support after this course ...
673,Anirudh,POWER pack course 
674,Code350,What will be the duration of this course?
675,pankaj thakur,"Please revert to old dashboard ui,
It's confusing  and messy for students to acces a particular section,
Why to fix if something is not broken"
676,Murgesh Patil,Is it also there in java?
677,Neel Jain,Will this be part of one neuron?
678,Ambuj Dubey,One question will it be available for tech neuron subscribers?
679,sai sankar,What is the option for priority queue?
680,Abhinav Srivastava,Sir is this job gaurantee program as you are providing in javascript bootcamp????
681,PeP,Is there any plan for DSA with Java
682,Sanket Hande,Will this course be available for one neuron subscribers?
683,Ajay Pathak,From when this course will start?
684,jitender singh,Another one 
685,bp,What is the prerequisites sir? Please answer 
686,Madhusudhan,be proud to be LCO user
687,Shubham Kamble,Exciteeeeeeeeeeeeeeeeeeed! Enrolled just now
688,Shankar Gowtham,"Hi Hitesh, can we able to join to this course now?"
689,durgarao y,is it self paced course ?
690,Coading 1,Sir it will start in April?
691,Ravan,Quality of video is DOPE
692,Rohan Choudhary,Enrolled hope we will be able to conquer DSA
693,Sandeep,When you will continue JS marathon 
694,Vinayakram,Will this course avaliable for Tech neuron subscribers
695,Hitesh Choudhary,"Check more details here:
https://hc.lco.dev/dsa
USE code HITESH10 for additional discount
Bundle in LCO for DSA will be given to all users but it takes 2-3 days."
696,YunAS,"HTML and CSS Layout - 
https://youtu.be/4l7jUOc-2QQ"
697,Kovendan Ragupathi,Thank you so much @Hitesh Choudhary.
698,Aman saxena,
699,Mohammed Amaan Hashmi,Can we have dsa course with java
700,Joy Sengupta,Awesome
701,Vinayakram,Excited 
702,Abhishek Khatana,Sir aap DSA dono language mein karoge
703,p jayalakshmi Jaya,Course duration ?
704,Mr Waqas,I don't have any degree only I've intermediate can I get job
705,optimus,Im college dropout is dsa good for me or webdevelopment(should i take this course)
706,Tyro Elohim,oh i think c++ is mainly useful for DSA. Don't you think?
707,sumanth sure,Why C++ is not used
708,Prakhar Sharma,Wohoo
709,Ratnadeep Saha,T_T why not java?
710,saurab bhattarai,JS MARATHONNNNNNNNNNNNNN
711,Harish venkatesan,First comment and view sir
712,Murugaraju Perumalla,まぅてました
713,rahul g,"I just clicked 3 times to watch video because of annoying Ads. Now closing the video because it's too much step to get information. 

I.e. disable ads for such promotional videos ️"
714,Krishna Pal singh,first comment 
715,optimus,Fang mang
716,Travelsoul uttrakhand,"Hitesh achieved NIRVANA level.
No more Hunger for money.
Just doing the stuff he loves 
Love You "
717,vikram urs,"I'm loving your approach towards continuing LCO legacy..
LCO is truly an emotion for me....it has added a lot of value into my life....
Thank you hitesh for all the great work you do..."
718,Abhay Anand,thanks for such efforts hitesh sir and a wonderful gift. To be honest I was really gonna buy pro subscription again next month bt your gift made me really soo much happy i can continue forward. Thanks a lot hitesh sir and I'll try my this final year in my college to get best job just because of your help!
719,Qwerty Ali,"Thanks for thinking about we ""new"" webD students sir. Much love  "
720,rithvik reddy,You are the person who really care about middle class people .. thanks a ton sir!
721,Frederic Guerra,"Hello, I love the idea to provide quality education to the most possible people.. It's a really nice and honor full idea.. Hope to see you in France maybe someday!
Happy to be part of this positi energy.."
722,Vaibhav Naik,"On the occasion of guru poornima I would like to congratulate the edtech teachers from whom I learnt programming. Hitesh ji you are also one among them.

So happy guru poornima to you as well."
723,shravan kaul,"Thank you for the generous gift for your javascript bootcamp joinees!!
Kudos to your spirit, Hitesh!"
724,Ravinder Singh,Thank you sir for what you doing for us 
725,MUTHU VALLI 3,"Getting some freshness and energy when you are talking about our ""LCO"" HITESH SIR..."
726,yash rajan shukla,Look at the quality look at the color grading look at the lighting.. wow! You are setting high class benchmarks.. truly appreciating.
727,Abhishek Das,LCO pro is the killer deal almost letting you learn anything  what a wonderful gift.
728,Daniel William,"Gosh yaar! This is so generous of you. I wish I had found you a year back before when I took a course elsewhere. Your videos on YouTube are super helpful and motivational.

Thank you for your work."
729,Tensor #,Amazing opportunities !!! I Liked your efforts of giving back to community.
730,chakravarthi tangella,"Thanks a lot Hitesh, for your support. We won't let you down.️"
731,Develop & Chill.,"Sir thanks for the LOC pro 
Enrolling in full stack javascript developer bootcamp is great decision, looking forward to learn more from you."
732,N Ashish,"sir Thankyou so much that you are providing courses at very low rates... i want to learn full stack....but i can see 2 courses on ur website which one is good......1.fullstack with django and react., 2.full stack django  freelance ready"
733,Sourabh Mahato,"Much love sir, LCO will always be emotion for me. "
734,Mujtaba M,LCO is an emotion!
735,Vipul Jain,Kudos to your efforts! Happy Guru purnima sir ! 
736,Saurabh Sikoria,Always helping the community.
737,Ponmurali Jeyaprakasam,Thanks Hitesh I am murali from maduraitamil nadu very thankful to you for LCO pro i am already a part LCO + Full Stack JS course of you i am follower of you once course is done i want to work with you in remote its my goal
738,Rishu srivastava,this is amazing sir you are great and thanks for lco pro subscription i am really excited  learn from you
739,Abhishek Yadav,That's a really great step️
740,Praxss,"4:35 Just one suggestion/question regarding that remote job for answering doubts,

Can that not happen on Reddit or something, so that more people can join and give answers to questions and of course it will be without charging money. 
But yes course content will become public without buying it"
741,Ayush Vanvary,LCO is Marvel Studios acquired by Disney(iNeuron) best two Merger of all time.
742,Gilbish Kosma,Thanks for extanding the LCO Pro subscription 
743,Murtaza Rangwala,This will help me alot. I will learn more with new learners.
744,Aniruddha Das,Great News sir! Thanks for the LCO pro !
745,Abhijeet Jadhav,Thank you so much Sir️
746,India Travel Vlogs,Keep it up! You are like God for indians
747,Saksham the computer guy,"A video with good vibes ️
#LCOOOOOOOOOOOOOO"
748,Viru Sutar,I started loving this guy more than my gf 
749,Hope,Please bring tests or competitions for development
750,Rushikesh ganesh,Amazing 
751,Abhishek C. Pathak,This man will definitely challenge Elon Musk in coming years.. ️
752,P S Patro,Kindly make the videos of devops and azure day to day activities and internships and hands on projects and roadmap. Make the video of remote work in india and outside india jobs.
753,Ratnadeep Saha,
754,Asif Khan,Hope for a free blockchain course in LCO
755,PRATEEK JHA,Great Oppertunity..
756,pankaj thakur,"Feedback for iNeuron:Please revert  to old Ui,
Your new ui is quite messy and confusing while accessing course content
Also remove the unnecessary videos added to a particular course by some other creator"
757,harsh bhaksaar,Hello sir big fan of yours...Please make a course on Devops. 
758,Nitin Gupta,Sir I an am experienced Android developer and want to learn from you how can I join you.?
759,Kalimuri Gangadhar,LCO long live 
760,Vignesh .V,"Hey Hitesh,
Why you are not taking anything about angular updates.
Please make a video on that.

Big fan of your work"
761,Quote Shades,Thanks aaaaa lottttttt... So many good news...️️️
762,DEEPAK DHYANI,Hitesh-Do you have Freelance/part time jobs?
763,URMIL❤️,Thank you sirG ️
764,Tejas,Thanks a lot sir.
765,Red Crow Crow,Damn i was going to buy lco pro this week since my exam just finished. Sir please please take registration atleast for 1 day i am willing to give 5k i can stretch this much only. Please please sir just one request if i knew i would have bought it early.
766,INDIAN ARMY,can you please cut down Django and python course prices...
767,Ritik Gupta,Thank you very much sir
768,Shyy Gamer,This was sad update for me i was about to buy pro this  week and this happened 
769,Nikhil Bhosale,Thank You So Much  sir
770,karyaken,Nice 1 hitesh but also give the once who joined job guarantee javascript life time Tech neuron subscription  
771,Madhusudhan,Great thanks for updates
772,Sahil Fruitwala,Back to good old plain tshirt 
773,Mangesh Thakre,Thankyou so much sir
774,jitender singh,Thank you soo mchh hitesh sir today i enroll in your js bootcamp just bcz of u sir but as you said i didnt get any email regarding lco subscription
775,The Indian View,thank you so much sir
776,Bittu Kumar,"Hi Hitesh How are you???
Your teaching style is good but some time you skip the important topics"
777,Nupura Brahme,Thanks a lot..
778,Shankar Dinesh,"Hi Hitesh, remote job apply is no longer access while trying to apply, is the hiring closed for the role?"
779,Shyamendra Hazra,Excited very much sir 
780,Praveen,"Please  create videos apache spark, scala and airflow  .Request  you to please  create"
781,Rishabh Dhawad,LCO ki jai ho 
782,Vaibhav Pandey,Wow 
783,Shashank Mishra,sleek and simple grey again!
784,voice,is LCO free for other courses of iNeuron?
785,Harshit Kumar,The monthly one you giving that to person who tops ...he already knows the stuff other people needs it
786,Haidar Shaik,@hitesh can I buy now JavaScript course .
787,girish sharma,Wow thanks. For pro excess
788,Rushikesh ganesh,Thanks alot
789,Anuj Kumar..,Sir your course available in hindi or not.
790,Hope,"Wohooo

But i have got a job after doing lco pro so can't join. Sadly. But I'm very happy"
791,Rohan Choudhary,"I had purchased LCO PRO  6 months Subscription? expiring On 22nd July, 2022 will it be extended?"
792,nagma firdoush,Can you have more opening for the remote role #Hitesh Choudhary
793,Avishkar Live,amazing sir
794,Aman - TheCompSciGuy,I hope iNeuron ko ab koi business minded edtech giant na acquire karle price bdhane k liye. Quality+Affordable = Hitesh gang
795,YouAndImpact,Amazing 
796,KUMAR SARVESH,"Was waiting for it for a while,"
797,Dinesh Rout,"Did mern bootcamp almost 80%...completing it, and applying ASAP."
798,bob mishra,Take care of your eye sir
799,yoan bello,Hello when is back Javascript marathon
800,shumaila sami,I didn't get this increased validity on my courses.
801,Hutyappa With Sunil,Link is not working to apply for remote role.
802,Devansh Singh Parmar,"Sir, I follow you from years, Never saw your eyes in this condition left one, please have a checkup."
803,Amit Kumar,
804,Chetankumar Bhagavantgoudra,
805,Vivek Maurya,️️
806,Hameed Asmath,Niceee
807,Varad Gauthankar,Form is no longer accepting response
808,Aditya Jindal,"sir, what happened to your eye?
are you doing okay?"
809,Abhi Vishwa Vlogs,Just say wow
810,Bishal Nandi,Sir I enrolled in the Javascript Bootcamp on 10th July but I am unable to access LCO  
811,harsh,Wow......
812,Tech Life Journal,3:23 yeah bois moment
813,Goutam Reddy,Some nice is coming from your Mike..
814,Tech-Man,"The form is closed, not able to apply."
815,Namaste coders,I am a member of full stack bootcamp
816,CHE tan,Sir aap kuch jyada he Dil dar nahi banre ?
817,Ravan,I love you sir
818,Debadrita Ghosh,Yayyy!!! Free Subscription 
819,Srikanth Racharla,What happen Hitesh for your left eye ️
820,Shaheem PP,Forms is not working
821,Shubham Chauhan,not the first one but someone viewing after 12 min of release
822,Raju Webdev,1st view sir 
823,Gautam Nath,wohoo 
824,Scripty Vijay,Hi Hitesh It's showing expired :(
825,Namaste coders,Thankssssssssssssssssssssssssssssssssssssssssssssssssssssssssssssssssssssssssssss
826,Yashi EL,"Only Indians can sign up, I guess. No other way to sign up, I'm from Sri Lanka."
827,Subhash Chaudhary,Wth !! Are you serious? One more year?
828,lenin singh,some course are not accessible like nodejs course. is it not available to anyone?
829,Mihir Adarsh,First
830,Namaste coders,wawwwwwwwwwwwwwwwwwwwwwwwwwwwwwwwwwwwwwwww
831,Ujjawal Chatterjee,Your left eye looks tired and red. Take care.
832,Saviour Seelan,"Form not working bro , what can I do"
833,Namaste coders,Love Youuuuuuuuuuuuuuuuuuuuuuuuuuuuuuuuuuuuuuuuu
834,Faizal. dev,Sir your right eyes looks red
835,Muhsin Abbas,Miss fill form bad luck
836,Tech Life Journal,0:35 your right eye is so red. take care buddy
837,Chandni Dalal,What happened to your right eye?
838,NIKHIL KUMAR,Nothing for user who have purchased ineuron subscription
839,Abhishek Surela,I'm sorry to ask what just happened with your eyes?
840,Harjot Singh,Thank you sir for LCO pro surprise i am really great full for this kind gesture 🥹 pls pls pls sir its a request make a IOS bootcamp as well
841,Saabir Mohamed,"Thanks for this tutorial, just something to note ...instead of using UUIDv4 you can just pass the string ""unique()"" and appwrite takes care of the unique ID generation for docs or users.
then you don't need to import the UUID lib at all."
842,janupa silva,Thanks a lot for this masterpiece. Really helped me a lot. :)
843,Filipe Valente Gomes,"Would be nice to shows us file upload, like using a storage and reference it to the user that uploaded it. Nice video btw."
844,Indratej Reddy,Inspiring. it is rare to see someone building opensource tools that too from India.
845,Dharanidhar Ch,Hey Hitesh.. Thanks for all the content.. I have recently got Mac M1 and not liking the magic keyboard and mouse much.. Could you please recommend
846,kapil vishwakarma,"Hello Sir, thank you for this, can we use appwrite for offline database?"
847,Vandit Pandya,Thank You so much sir  ️
848,PUS PAJE,completed sir ... and working properly.
849,Vandit Pandya,"58:42 You added role:all at starting of the video but sir you missed to hit upgrade button so all roles gone dumped  .
<it's happen sometimes>"
850,Vaibhav,Love your Efforts In These Videos Hitesh SIr...
851,Sudhindra Pai,Love it sir.. Btw no 4K this time?
852,Aman soni,Cna i use normal Promise Syntex instead of what you are using in the video ?
853,Shrey Dadhaniya,"Hi,
i think location.reload will work if you put in .then() not sure but i guess i will work or you can use await"
854,Amit Kumar,Love it....
855,Parth path,I have I3 laptop  and i am  interested  in it field  I learned mern stack through you tube can you suggest me a course with placement
856,aniket jadhav,Hii guruji love from your student️
857,YouAndImpact,Great 
858,RITIK Singh,Pre requisite for this course???
859,God Coderz,How to host it on server?
860,Amiya Mishra,Thanks for this 
861,Luv Official,Fantastic choudhary Ji..
862,Praxss,"Nosql is okay, but integration with sql would be better"
863,Maheen Kabeer,What happens to JavaScript marathon?
864,Shekhar Chaugule,Provide Github link
865,Aman saxena,
866,Sambit kumar,"Yes, sir"
867,Ankush Jain,Hello sir Hindi me bna diya kro video
868,jagannath sahu,"Hi Hitesth, I have close to 9 years of IT industry experience....For the first 6-7 years of career I worked in different data warehouse and ERP applications...From last 1.5 years, I have been working fastapi, flask frameworks...Will this course be useful for me?? Waiting for your valuable suggestion."
869,YouAndImpact,Amazing initiative 
870,harsh Singh,"I am from a non tech background with 2 years of gap.
Will I get placed if I join this course?"
871,vishal rajivade,"I have one doubt here, appreciate if someone answer my question:
Is this course good or beneficial for someone who is already working with 2 years of experience in java. 
I have 2 years of experience in java but I am really interested in web development. Can this course will help me to get a job in good company and transition from java to web development.??

Thank you for answers"
872,Hemanta Dey,"Hello Sir
I am working in PL/SQL Background. How to change my domain  PL/SQL to Full Stack Developer."
873,TruthSpeaker,In college we get multiple companies to crack he should give chances till the next batch starts
874,education international,"Hello dear Hitesh, I am currently living in the USA when you say job garanted this is can also be applied to us who live in the USA. Can I apply for the program ?"
875,Shubham Shubham,"hi hitesh sir i just(an hour ago) got result of my jee main july exam i got very bad percentile(77) and i am so sad by this i am a dropper and i have studied really hard but not able to solve problems of physics and also not grasp all the things in chemistry so i got very bad marks on the both subject physics and chemistry.... sir i my dad has only one shop in my village and this is the only source money we have sir i as you know all the private btech colleges are very expensive we can't afford that and i wanted to take a job in web development part and i am following your courses and learned from other resources....bt i am seeing the price of the full stack web developer course is very minimal from the 3 4 months studying in btech colleges at the end i only want a job of web developer do you suggest me that i can join your full stack course and not doing any degree i am 2021 12th passout sir
please have a look this means a lot sir i can not thanks enough if you give some feedback in my situation i am so depressed by this situation"
876,Rahul Choudhary,Wow 
877,sourabh,Recordings of this course will be their in one neuron Ott??
878,Next Gen tech,sir can I get intern without college degree
879,chirag roy,️️
880,Dinesh Patil,"when will be next batch starts ?  i want to join this batch but enable to join , plz reply ineron"
881,Udit Kundu,Sir which is this course you talking about
882,NMV,can we join course now?
883,karyaken,Course so expensive Tech neuron lifetime subscription should also be included
884,TUBER DARK,
885,saidshah Ahmadi,Is this course will upload to Youtube?
886,Abish Bangotra,From where i can get this course. If anyone can help.
887,Rajeev,Can i join it now?
888,Yogesh Ukidwe,i am waiting for flutter
889,Pramod Reddy Pandiri,Can anyone say till which video we have to complete this week????
890,Sanam Pakuwal,Java Script? 
891,Namaste coders,Sir khana kha lijiye bahut time ho gya hai aaj 4 hours plus live with just iced tea...
892,Calm music,will this course get  a job?
893,Divya Kumari,"I really wanted to purchase this course but the price ...
I can't "
894,TruthSpeaker,Not job guarantee you only get to crack 1 interview. No second or third chance feels like scam
895,Quote Shades,@2:09:52: HRs got roasted
896,Appwrite,Cool video Hitesh! 
897,Aman soni,Sir i do basic MERN development should i learn Docker and containerise my backend. Also you Docker series on YT is it enough for starting ?
898,YouAndImpact,Great tutorial 
899,NITESH PRAJAPAT,What is the use of Appwrite ?
900,Deepraj Baidya,"I have some virtual machines installed in my Virtual Box, after I installed docker I faced this problem where, my Virtual Machines were not booting Up. If Anyone knows why this is happening please let me know"
901,Divinity Technology,Can I use appwrite for production app?
