,commentor,comment
306,Tushar Vaswani,Sir would laptop be provided for hackathon. I have a desktop but not laptop.
307,Anirudh,
308,redCoder,sir Gujarat when? especially Ahmedabad ?
309,Akash Singh,Hi histeh need to join java script bootcamp but i got to know courses already started and hestitating to join the course in between let me know when neq batch will be start? Or what you suggest
310,JAPSIMRAN SINGH,See u there Sir
311,Yaaaa Yeet,anyone wanna team up ? (for web dev.)
312,Ashutosh Bodade,Can outside people also take part in this hackathon or just for lpu alumni
313,Lans Kaba,So excited to meet with you
314,T SONU KUMAR,Any one can participate or only for LPU University students
315,shubham singh,Sir chandigarh university kb aaenge
316,Siva ram,OMG sir putting my life journey msg on your valuable videos more than a job I got this make me so emotional  thank you so much for the work you are always doing for our community keep changing the Life's better (as always let God gives you double of what you give others)️️️
317,Flavoured Flight,"Thanks guruji, you have been my teacher since my starting days in both coding and gym"
318,Ishaan Wadhwa,"Great work Hitesh, wish more people in India contribute the way you are doing. You are a role model for many in the IT industry."
319,Joydeep Debnath,Thanks Hitesh for the course. You are truly doing a great job man 
320,Nidhi Jha,Thank you so much for everything you are doing for the coding community. Love from Delhi 
321,Fkshafar 123,Hitesh thank you to bring affordable education in India.god bless you 
322,kotesh kunapuri,"this is awesom support to the students thanks a lot sir , and i am a big  fan of you for your ideology in Tech education and you are providing the course very low cost compare to the other tech institutes thanks a lot more love you sir ."
323,Venkatesh Lingampally,Thankyou once again for this Hitesh sir I'm looking to take this course on LCO but I'm stuck with my exams. Also missed this chance (I'm out of 1000) but definitely i do take this course ASAP  because I really need this course. Thankyou once again. Hope this reaches you.
324,Devangi Solanki,Thank you so much for providing amazing courses and support to the student (coding)community!!!
325,Dinesh Rout,Thank you sir for this course . My last goal is to help students like me to get tech job apart from becoming an software engineer.
326,Ashish Tyagi Arya,You are doing amazing for the community. Thank you so much for everything. ️
327,Sumanta,"Thankyou Hitesh, you are really awesome, and you are always awesome. I am in Bangalore and due to some of office activity not able to join the offline hackathon, do you have any plan any offline hackathon in next few month and i  really want to meet the Ineuron folks and you especially, let me know if any opportunity is there. and thanks for your support for coding community. Thankyou ."
328,Hussain Bhagat,You are doing some really amazing things. Thank you so much
329,Kishan Aher,Thank you @Hitesh sir to bring this most amezing chance to learn something like this .
330,Vivek Chudasama,"Thank you for everything. Sir, I feel happy to be your student!"
331,Priyanka A,"Thankyou Guruji!! 
Great initiative sir..Excited to learn a new course from you !!"
332,sumit sinha,"Sir great  work!
I just able to avail it sir!
I appreciate the way of explaining things sir."
333,Abhinav Srivastava,Sir you are God for coder community lots of love. 
334,Piyush Sagar,thanks for the free course  I'll do it after my semester end just few weeks to go 
335,parag sawai,"Very Great initiative taken by you Sir.
Very Nice."
336,Vikas 0018,We new developer loves u sir like our father️
337,rAHUL kr,Don't know what to say but at least I can say that Thanks for this free course.
338,Jigar Prajapati,Thanks for every single course. I'm b.com student and learn a lot from YouTube.
339,JBN Treasure,"Thanks a lot, Hitesh for making this free"
340,PRATEEK JHA,Thanks Guru... U r a true Gem.
341,Indranil Kar,What you are doing is amazing !
342,Vaibhav Naik,Thanks for giving this course sir
343,Abhishek C. Pathak,Hats off to you sir..!!
344,Patel Ronak,Thanks sir an amazing courses
345,voice,"Couldn't avail the offer,but I am happy to know from the comment section that many have been benefited .Thank You Sir."
346,Manpreet Dhaliwal,doesn't matter if I get free seat or not but I am sure atleast few of these free seats will go to those who actually can't afford these courses. great personality. it takes very big heart to gives put something for free irrespective of the price.
347,BORN CODER,Sir is the c++ bootcamp course up to date.? Should i enroll in it or is there any new c++ course coming ?
348,shruti math,Thanks Hitesh Sir.. Your just awesome
349,Das p,Thank you for everything!
350,Swarnadeep Ghosh,Please include the course in Udemy Business
351,Rahul Sharma,Thanks you for doing such giveaway
352,Yashwant Mangate,Thanks is just a small word for this one.
353,Masfik Alam,Joined! Thank you so much sir <3
354,Big Data,Best part is that i have completed the course and it's is the pro level course
355,Dev Patel,Thank you sir ️
356,BABA,"You should be a therapist or something...man that voice is so calming its like all the effects of ASMR videos, bhajans, lofi reverbed songs combined.

But thanks for being here for the community. Although I don't understand how do you stay profitable with all this going on especially now with these freebies.
Even though I missed the opportunity of getting this course, I'll be on the lookout for more in the future

I've got no jobs (I'm looking for internships tho :p) or great motivation as such, I just love the work that you're doing.
Thanks again

(Hope I get some job from your courses or challenges, I'll buy you some proper tea...I mean whatever the f is ""ice tea"" huh ;)"
357,Aamir Hussain,Thank you sir ️
358,prathmesh bendbhar,Great Sir
359,Abhishek B,Thanks a lot sir .
360,Edujee,When Will Javascript Full Stack Web development New Session Start
361,Shyamendra Hazra,Feeling great to come this soon
362,Suchit Mukherjeee,Thank you sir for this chance
363,Yugal Korde,Waiting for full stack javascript Web development course new session.
364,Vishwanatha,Thank you Hitesh sir!!!
365,Vivek Vadadoriya,Thank You Sir.
366,Tejaswini Jadhav,Sir can we entroll in ongoing full stack web development course
367,Muhsin MK,Thank You sir 
368,BHASKAR KULKARNI,Thank you very much sir!!!
369,Srikanth Adepu,Thank you for ur free course.
370,Ankit Sharma,Great Sir 
371,Gopal Kannan,Thank you sir.
372,Abish Bangotra,Thanks a lot sir.
373,SYED MINHAJ HUSSAIN,Thankyou Hitesh sir
374,HARDIK PANCHAL,You ar just amazing man
375,Galaina k,Thank you Hitesh Sir
376,gaurav goswami,you are best love you forever my code thanks to you.
377,Chandru RCPM,Thanks man ️
378,CHE tan,Sir is your javascript bootcamp accessible in mobile phone 480ps
379,Mihir Adarsh,"First️, and Thanks a lot for this course. You are the best️️"
380,Fkshafar 123,Thank you sir
381,Rahul Shandil,Thankyou sir
382,vasanth 18-2F9,thank you sir
383,Prem Kumar,Impressive 
384,shannu vk,Thank you!!!
385,chedde saikumar,Thankyou so much sir ji
386,Abhay Tiwari,धन्यवाद  Sir
387,O T CUBE,real gem of coding world
388,Technical Om,Thank You!!
389,098harsha,thank you :)
390,pankajkcodes,"Good Job Sir
 But I'm not getting this course"
391,Jimmy,Thanks a lot..
392,Amandeep Soni,Please talk in detail about be a devops pro course which is going to come on ineuron
393,Amit Ramesh Jaisinghani,Great !!
394,Ravi Mahar,Great 
395,notsure,Thanks 
396,Saurav Kumar,Awesome
397,jayanta das,Love  from Assam
398,Shashwat Deshmukh,
399,Bishal Nandi,️️️
400,CodeInDepth,I want to buy frontend course sirji so when can I except frontend course on udemy.
401,SIDDHARTH SINGH,Missed this one
402,BORN CODER,Hello sir
403,Divash Gupta,
404,Surya Pandey,Coupon code not working.
405,Shreyash Chavan,Aap to bhagwaan ho..
406,MUTHU VALLI 3,First HITESH SIR...
407,Rahul Saw,I've missed out 
408,Noble Niraj,"update the course 
Starting November 28, 2022, free Heroku Dynos, free Heroku Postgres, and free Heroku Data for Redis plans will no longer be available."
409,Gaurav Sharma,Code not working
410,indietuts,Voice base is too much !
411,ALBERT ALI,"YOU ARE AMAZING BRO ,ISO ENTHUISISUM TO TO LEARN BAKHEND DEVOPS .READ TPO STUDY"
412,Manish Gupta,I had already bought it before and now it hurts seeing being offered for free
413,aniket raikar,Thank you sir
414,bhavesh more,Great 
415,Md Saiful Islam Shanto,Thank you sir
416,YouAndImpact,Great 
417,Mc Spraint,For this person I turned myself from a drug addict in to a full fledged software developer working at a company where I enjoy working really a lot
418,ARPIT MISHRA,Hi hitesh... I got a job and took a break from learning from you. But right now i feel its time to get back to your courses. Always greatful for your guidance sir.
419,Ramadevi Atmuri,"Hey Hitesh sir, You have said in this video, that we have to code for the community page, but in that challenge you have or company has mentioned at the last 3 points that, we have to create the ""ADMIN SETTINGS PANEL"" WHERE THE ADMIN CAN CHANGE THE CONTENT OF THE PAGE BY HAVING UPLOADING THE RESPECTED VALUES OF EACH ELEMENTS OF RESPECTIVE COMPONENTS... "" 
isn't it the challenge? Or we just need to clone the community page? Please explain briefly sir... Please refer the last three points of the overview."
420,heatengine,"Hi, hitesh, very nice thing you are doing and thans for that. I am a 23 yo programmer having 2+ years of experience, super ambitious and eager for career. But things turns out wrong here =====>> I dieagnized with a rare eye problem and now I can't work as a frontend developer or UI UX developer (which I wanted to be in) as can not see properly in white mode theme. Please let me know if anyone or you has any person with same challenges and how to cope with this.

Thank you"
421,Saloni Singh,"Hello Sir, I always wanted to work in Tata. Tata imagination Challenge is going to start soon. Please suggest me some tips so that I can qualify for the same and fulfil my dream."
422,sapan jain,You are amazing sir
423,Akash Singh,Humble request to just increase the timeline of bill split app hackathon for at least 8 - 12 days. Thanks.
424,ASHIRVAD,Amazing sir
425,Santu Das,It's great things ️
426,abhinav kumar,"Is this only for working professions? because I went to the website and various experience, current job and salary structure is asked.. I am just a student :')"
427,Telugu Dev Hari,Next hackathon keep at hyderabad 
428,pankaj thakur,When will the next batch for Full stack JS Batch will be launched?
429,Venkatesh Lingampally,When we get Android hackathon online..
430,Aman saxena,
431,Kirtan Chandak,"Website is disabled, please check once."
432,•N!Kh!L D•🔱,"Bro i am done with earth, it's too much crowded.. i want to go to Mars"
433,Gokul Deva,once again that grey shirt !
434,Nattu Kaka,Mai  lega esme  bhag bhai maja a jaayega
435,Jasjot Singh,1st viewer
436,Mc Spraint,Second
437,Ruhan Khandakar,first
438,Sandeep Kumar,2nd
439,Zeeshan Safdar,"Hitesh, your live sessions are way better than recorded videos. :) Thanks for producing quality content, TechEd Guru"
440,Naveen Singh,I have enjoyed the great quality content today. Thanks
441,Maheen Kabeer,"Complete JavaScript playlist. Please be consistent. First complete one thing, then jumb over to other."
442,Patel Ronak,Waiting for JavaScript Marathon
443,YouAndImpact,Great 
444,SHUBHAM JADHAV,Is php use for frontend development
445,Patel Ronak,
446,Bishambar Sharma,Sir please help me in python and c# file convert in to APK file
447,Nayan Patil,"Hello sir, thank you for this great series!
A suggestion - 
we need to run ""npx prisma db push""  to synchronize a schema with a database, Otherwise, constraints like @unique, etc will not get applied to MongoDB. I was extending the signup endpoint then I got to know MongoDB allowing to insert a new user with the same email.
Thank you."
448,varshil shah,"Hi hitesh sir, learning new technology from you is always fun.
I figured out a bug/mistake in your jwt.verify function, it actually expects callback or we can use promisify instead."
449,Anuj,"Hi sir, can you make a small project with prisma graphql server?"
450,Aneerudh,"Hello sir, what was that cli tool which was helping you and giving the auto suggestion on commands while typing in terminal...... Is that available in linux too?"
451,YouAndImpact,Great video 
452,aniket bhalla,Is it safe to send JWT token in response to frontend?
453,Aman soni,You didn't used Bcrypt to encrypt password
454,MohanRaj Raman,How to manage models in separate prisma files?
455,Patel Ronak,
456,Adarsh,Can someone tell me the font name?
457,Shyamendra Hazra,"Hitesh sir be like : ""oh no some spare time!! Just contribute to the community.....""
What a divine blessing upon earth, sir your dedication is also a great example for us. Thank you very much sir for such a generous effort. You taught us how not to hesitate to take from the community and not to forget to contribute back to the community again. Huge respect towards you sir ️"
458,GG TySON,You are doing amazing sir I just missed your live  But I am watching now the full video and is so much useful to me please ignore the toxic people You are the real open source hero as you are teaching cutting edge technology for free love you so much for all the stuff you go on there may be many negative comments but still you didnt stop teaching  and go on with the good vibes
459,aniket bhalla,Thanks sir for the session. Just finished watching it. I hope to have more in the future. Thanks again for your efforts you're putting in.
460,jayesh shinde,"hello sir , in my college we have group presentation . there are 10 students in each group. my group has got topic as "" devOps for spring microservices"". so sir can  you  pls suggest 10 sub topics for this topic on which each student from my group can present that topic upto 3 minutes ?
pls help sir"
461,Gautam Patnaik,Thank you for this session. Learnt a lot about backend and prisma. Please connect it to frontend. 
462,Sandeep,"Back to back live , now we can feel the energy "
463,Souvik Roy Vines,This is great sirthank you for sharing
464,Jimmy,"Informative video , make more such videos."
465,chirag roy,sir when i see you anywhere over the internet you always be mine first choice forever
466,cathrine chelladurai,Sir can you post  a video explaining gRPC
467,my home,Sir I have a break after my graduation so please suggest me can I understand this
468,Aneerudh,"Hello sir, what was that cli tool which was helping you and giving the auto suggestion on commands while typing in terminal...... Is that available in linux too?"
469,YouAndImpact,Amazing 
470,Nikhil,
471,Patel Ronak,
472,Digiheadway business,sir aap ke java scrip ki vidoe kab aaye gi or
473,Md Ehsan,You are the only one who pushed me and motivated me as well to do a lot in coding..... it's not a complete change from the day I had started learning with you  but a drastic change I have experienced in my self now I am able to think and do the project seamlessly whereas in the beginning I was completely freezed when you told we have to do that much project. .... please keep you love and support with us..... thank you so much sir ji....we really need mentor like you.   
474,Jaya kumar,"Hmm.. hitesh energy level are low. He looks really tried, but still taking class for us. Dedication god level"
475,Ankush Ladani,Thank you sir for this session...
476,yash rajan shukla,That wall  perfectly color balanced and adding so much in the scene
477,Manoj Kumar,Please continue more videos on talwind
478,Bijaya Giri,hello sir...take care...and thank you for this video ...from Nepal.
479,Abhay Tiwari,thank you so much sir
480,Amit Kumar,"I was waiting for this content/course after my first class in tailwind. once again thanku sir,"
481,manish keer,"Why can't we just write css, instead of writing classes for each style.. I feel that's a more clean way of writing html and css. This looks unnecessary.
Thanks for your video efforts though."
482,Anirudh,
483,Deepak Sebak,What happened to javascript course
484,Murugappan Ramanathan,I am sorry Hitesh one of your course in udemy is below par. I don't believe this would be any better either.
485,Parkes Teasha,Kirk
486,For Valor!,Sir your too much girly while talking. D
487,yash rajan shukla,Once a LCO fan always a LCO fan because you never disappoint to suprise us whether it is your video quality or content of the video
488,Anirudh,"Years of dedication, coding & passion towards one single goal "
489,Lüçîfēr,Can't beleive sir...  Thank you soooo much. This step would really count as remarkable for nation building. ️
490,66 Taslim Muhammed Moosa,you are a really good teacher️
491,Venkatesh SV,"U r best in education Marketing also 
Ur business model for Ed tech so good "
492,Aasim,"I love you sir... I love you so much.
I teach frontend development online. I was using teachable but recently teachable discontinued new video upload for free plan users now I'm stuck I can't add new videos.
Now I will switch to Learnyst.
Thank you so much sir"
493,Amita Singh,Thank you Hitesh we are so glad to have you ..
494,Nikhil,"Hi Hitesh sir, I have one request can u please make one VDO on Data Warehouse"
495,Vikash ravichandran,Good move as i teach latest tech at very low cost from scratch in my city
496,Tech buddy,Arey hitesh Bhai aap tho teacher se actor ban gaye 
497,YouAndImpact,Great 
498,dhiraj jaiswal,Great
499,KARTHICKRAJA,"Great Ad
All in All ️"
500,JOBIN SELVANOSE,️
501,Devendra Patel,One day you will become education minister. I hope
502,Aniruddh Singh,What about javascript course sir
503,Parul Gupta,Sir where is your javascript course
504,Gopal Kannan,Thanks 
505,Polite,️️️️
506,Bishal Nandi,️️️️️
507,Ha-na,still students have to pay that's how u earn money but good for teachers though
508,Yashraj Mishra,Thanks
509,Saurabh Shakya,Every Ed-tech claims they are going to change the ed-tech industry yet they are all the same
510,Surya Padala,Boss...what are you doing...are you not sleeping ... 
511,Nikhil,Wohh!!!
512,jhon sen,"Everything is a Business Now a Days, No one leave or Resign their job just for the sake of educating students for a longer run its kind of business. THere are very few people like code school who really uploaded some beautiful content but still their account not monitized yet."
513,Iliyas Khan,You shoul not have put add with this video
514,Fayaz Mohammad,"I'm sorry but maybe it's just me, the voice didn't quite make it. Sounded like dental add on a small tv channel. NO OFFENSE"
515,shaquib khan,"What a down-to-earth person he is.
It was a pleasure to devote my 32 minutes to hearing these two gentlemen."
516,Ranger boi,As a person who loves to make experimental projects everyday on a regular FastAPI really speeds up the development process :)
517,Atharva Kulkarni,I missed this man. I'm a big fan of this guy. Great contribution. His tech and your tutorial made it possible for me to backend developement.
518,Rudrakshya Barman,"Glad to see him, he is really humble awesome."
519,StockV,"wow, his mustache looks like rajput's mustache. bcz i'm also a Rajput. But yeah both of you are amazing. A infinite amount +ve energy.
And a lot motivation. greet and thank you hitesh bhaiya. You are my best montor at youtube platform for web development."
520,Shantonu Chowdhury,I love this man.. thank you Hitesh sir give an opportunity to get a brife  conversation with Sebastián Ramírez Montaño... thank you
521,dhanush holla,Great content ️
522,Achana Naga Durga Prasad,Sir when are the JavaScript clases going to resume on YouTube 
523,Jayesh Pathak,Great i am just start using fastapi and meet the inventor !!!   I have one query if you can help. I want to use graphql with fast api ( graphene ) with mysql and the same mysql django project is setup.   is it possible ? e.g. I create one django project dockerized it and then add fast api with graphql with common mysql connection
524,Sunil Poonia,Always Great️️
525,vamshi goud,I am currently completed my ug degree (bsc in computer science).so am interest in artificial intelligence. How to do msc in artificial intelligence in iit's Or other university. What are the entrance exams. Can you plz tell the process. It's more important to me...
526,KUMAR SARVESH,love this!
527,Vlogger Abhi,Sir i also want to learn coding frm you help me.
528,dhanush holla,Got insights about fastapi.... Will try to solve 1 problem at a time here after 
529,Moneesh Kumar,Great to see Hitesh and Sebastián
530,Nabajyoti Borah,"Hi guys , it's Nabajyoti here , whose LinkedIn question is asked  feeling proud "
531,Namaste coders,Great 
532,Swapnil Bose,Ahhaaaaaaaa!! Bangali YouTuber mone hochhe?? Jodi hai tahole Dada Khub valo laglo eto boro Bangali Tech YouTuber ke peye. Ar Dada Tumi kothai thako?
533,Anirudh,
534,Sadaf Shaheen,nice
535,UI Monk,"Sabastin, fan of your moustache.. cheers"
536,BORN CODER,"Sir please take this. sir what are your tips for me, I am starting college next month. what should I do to excel in the field? I have huge interest in CS..."
537,Mehedi hasan,Dear Mr.  Hitesh it will be very nice if you explain in detail about api... it's setup... etc
538,Luv Official,"Hi hitesh, when the devops will be launched?"
539,Manish Daga,26:24 Hear i am.(just for my refrence)
540,Nikhil,"I missed it ""random live !""random live !"""
541,UI Monk,Ur legend
542,Devendroid,09:07 what
543,mark cuello,HELP
544,Suman Kundu,I also missed
545,24_Charukirti Chougule,Writing code every day to build more stuff. Thanks to your videos 
546,Code Endeavor,To the next level - Hitesh sir - the voice of encouragement
547,Rishi Raj,"Exzellent work!
Very impressive and inspiring video"
548,Qwerty Ali,"Yes, #iwritecode all thanks to you sir. :)"
549,Saksham the computer guy,"Baday bhaiya always OP! 
#iwritecode"
550,Umang Pincha,"Yes hitesh sir , working on hackathon project , write more core -> build more stuff"
551,Amit Kumar,#iwritecode on top high label..I can imagine a big change is going on
552,Raushan Kumar,Unique as always
553,Srini cnu,"Hello sir I am in 8th grade my name is akash is there any chance to update FSJS bootcamp video.

Sir after the bootcamp can you suggest what I could probably do"
554,Chita mAR'S,Absolutely Good. ।
555,Shubham Shubham,Completed the Hackathon Project Code. Working on the explanation for the video. I write code.
556,Himanshu Kumar,Video & Audio quality is 
557,Ankur Saini,Please make a Video on Hexagonal Architecture
558,Prathap Reddy,I write Code 
559,Abhimanyu Malik,I write code 
560,Nikhil,I write code 
561,mayank kashyap,yes i#iwritecode all thank to hitesh sir
562,Kumar Amresh,"some awesome projects built by me :-
  Figma clone :- https://www.youtube.com/watch?v=rqtKGGTlQC4
  Ludo :- https://www.youtube.com/watch?v=NANSV7pPtRY
I have also built many other great projects, but I am proud of these two and I like to flaunt them everywhere "
563,secureITmania,As IT security researcher I debug code 
564,Anirudh,#iwritecode
565,yoan bello,Is over the Javascript marathon?
566,Bishal Nandi,️️️️️️️
567,Mr. Invisible,
568,Sandeep Kumar,First view  gurudev
569,"Sumit Kanth , 53",Sir coders ki job AI nii legi n ?
570,Junior Malcom,#iwritecode
571,Harshavardhan Teja,Let's write code
572,Patel Ronak,
573,Aakash Pal,Cool Voice 
574,Gaurav,
575,R kay Motivational,Jai Hind Jai Bharat 🇮🇳
576,Mayank Raj,I WIRITE CODE
577,Yashraj Jaiswal,Ye theranos beech me q hai 0:11 
578,Rise honeix,Sir wants to make movie
579,khumendra sinha,Yes
580,Shubham Gargade,First view
581,Sahil Jain,"Seriously Elizabeth Holmes with personalities like steve jobs, bill gate???"
582,Subhadip Chatterjee Vlogs,1st viewer
583,Peter Parker,I am the first who watched it.. Oo
584,clipss,Why is Elizabeth holmes in the montage she is a scamster
585,SIDDHARTH SINGH,Ad
586,tejas Jani,"this is my personal opinion , don't take it personally. I don't like this way of editing. Its sound negative, looks like a commercial ad."
587,Kshirod Patel,I write code because ... Code is Poetry ( ⓒ copyright WordPress ) :)
588,Gourav Singh Rawat,"An amazing idea could be, where multiple teams of hiring trainers/experts do vouch for the developers by their projects and other contributions. This will also support HRs, technical recruiters and developers of course."
589,Waqui,"Excited  to get placed in a tech company using the platform findcoder
Projects are on the way....
Pumped up!‍
Thanks, Sir-ji!"
590,SUBODH SINGH,"Another mind-blowing project by You. I understand this will certainly help front-end and back-end developers... Is there any plan for automation related like hackathon, challenge and opportunity to showcase project like framework? Thanks again for creating this!"
591,Anirudh,Talent  Technology= FindCoder 
592,Shivanand,"Wow amazing  
""Where there is a vision there is a way"""
593,shaquib khan,"Here comes the solution of tech hiring.
Man on a mission - > Hitesh Sir!"
594,SUBHANSHU SAHANI,Legend for a reason ️
595,Mt,Definitely findcoder is valuable platform I love it
596,Chandni Yadav,"Hi, 
Your application seems useful but I am experiencing a bug, I can't open any social site link of developers"
597,Anurag Katiyar,Great work sir
598,YouAndImpact,Great initiative 
599,Rishabh Thakur,Platform is amazing ️
600,Abbay Rai,"Can't wait to participate , from FSBD course"
601,Adrian Görisch,"Dose only work for public projects  If you work in a fiel with only private/internal projects, you cant use them, but you could be the perfect fit"
602,MUTHU VALLI 3,Awsome idea & good UI HITESH SIR...
603,naruto uzumaki,"Bringing in Democracy, 5:12  Nice! Now the  Democracy Index will improve, Hopefully!
 Incredible platform, by the way!"
604,Arnab Chatterjee,Plz continue js marathon 
